<?xml version="1.0" ?>
<thuvien xmlns:xsi="http://www.w3.org/2001/XMLSchema-instance"
         xsi:noNamespaceSchemaLocation="thuvien.xsd">
    <sach id="S01">
        <ten>XML Cơ Bản</ten>
        <tacgia>Võ Kiều My</tacgia>
        <nam>2025</nam>
        <theloai>Công Nghệ</theloai>
    </sach>
    <sach id="S02">
        <ten>XML Cơ Bản 2</ten>
        <tacgia>Bui Huu Nhat</tacgia>
        <nam>2025</nam>
        <theloai>Công Nghệ</theloai>
    </sach>
    <sach id="S03">
        <ten>XML Cơ Bản 3</ten>
        <tacgia>Lê Văn Mộng</tacgia>
        <nam>2025</nam>
        <theloai>Công Nghệ</theloai>
    </sach>
</thuvien>